{"$id":"urn:model-benchmark:schema:verification-artifact:v1","$schema":"https://json-schema.org/draft/2020-12/schema","additionalProperties":false,"properties":{"case_results":{"items":{"additionalProperties":false,"properties":{"id":{"minLength":1,"type":"string"},"outcome":{"const":"passed"}},"required":["id","outcome"],"type":"object"},"minItems":1,"type":"array"},"command":{"minLength":1,"type":"string"},"input_identities":{"items":{"additionalProperties":false,"properties":{"digest":{"pattern":"^(artifact|canonicalization|scenario|schema|score-contract|source-tree|uv-lock|verifier):sha256:[0-9a-f]{64}$","type":"string"},"name":{"minLength":1,"type":"string"}},"required":["name","digest"],"type":"object"},"minItems":1,"type":"array"},"issue":{"minimum":1,"type":"integer"},"output_paths":{"items":{"pattern":"^(?!/)(?!.*(?:^|/)\\.\\.(?:/|$))[A-Za-z0-9._/-]+$","type":"string"},"minItems":2,"type":"array","uniqueItems":true},"schema":{"additionalProperties":false,"properties":{"canonicalization_sha256":{"const":"canonicalization:sha256:5f871a41f05d8bab1af662a5c91cce456c05af84c77f602d0572da778ec5f3f9"},"canonicalization_version":{"const":1},"name":{"const":"model-benchmark/verification-artifact"},"sha256":{"pattern":"^schema:sha256:[0-9a-f]{64}$","type":"string"},"version":{"const":1}},"required":["name","version","sha256","canonicalization_version","canonicalization_sha256"],"type":"object"}},"required":["schema","issue","command","input_identities","case_results","output_paths"],"title":"Canonical acceptance verification artifact","type":"object","x-model-benchmark-schema-name":"model-benchmark/verification-artifact","x-model-benchmark-schema-version":1}