{"case_results":[{"id":"tests/acceptance/issue_55_digest_provisioning/test_digest_provisioning.py::test_cold_digest_pull_then_warm_inspection_makes_zero_registry_requests","outcome":"passed"}],"command":"@python-env/bin/python @python-env/bin/pytest -q tests/acceptance/issue_55_digest_provisioning --maxfail=1 -p no:cacheprovider","input_identities":[{"digest":"source-tree:sha256:aa57741e7b72b65ce0874a360a1e66a8ba7c7f517c20fc23474a328c34984482","name":"acceptance-source-tree"},{"digest":"canonicalization:sha256:5f871a41f05d8bab1af662a5c91cce456c05af84c77f602d0572da778ec5f3f9","name":"canonicalization-contract"},{"digest":"artifact:sha256:ff162fbdb60dd0d666863b48633dc5b8486bb8944d1a96e73d6e2e88f60a8886","name":"cold-cache-miss-image-identity"},{"digest":"artifact:sha256:c5de60e2cfe84baa5be4887aca63111e95ce56457b2a5119334844c045644a29","name":"docker-server-version"},{"digest":"artifact:sha256:cb8adae9ce48fa10aa1ff9651f7798307aeffc1be389ec84d9ea7cae0bf98b47","name":"failure-cleanup-complete"},{"digest":"artifact:sha256:f2654f53c16db79297ad7656fa7a56ef64fa4bc26af22c5874c358c7651f72d5","name":"launcher-argv-0"},{"digest":"artifact:sha256:a02285196b6e5f62a2c777186618fe2eef457c4f6d95cee0eee6ef0bf8bb5b3b","name":"launcher-argv-1"},{"digest":"artifact:sha256:3c65cccdb5c8c15153f9d8d20af780d5a732ff5c3b16813e0852a2f989fc46c3","name":"pyproject.toml"},{"digest":"artifact:sha256:f2654f53c16db79297ad7656fa7a56ef64fa4bc26af22c5874c358c7651f72d5","name":"python-executable"},{"digest":"artifact:sha256:618de7d9f46f3f697d827a1b6d84974760d5deda62e4e592adaa3c646602a94c","name":"registry-request-count-0"},{"digest":"artifact:sha256:92a4e38317ec211e12b2a08eec71a636085a77fa8348b290821323a8aadd6420","name":"schema-catalog"},{"digest":"uv-lock:sha256:ba64a736099f24fca8c94da2dad716613a52f65b21d8ac5e844b1a74040b1f26","name":"uv.lock"},{"digest":"artifact:sha256:ff162fbdb60dd0d666863b48633dc5b8486bb8944d1a96e73d6e2e88f60a8886","name":"warm-cache-hit-image-identity"}],"issue":55,"output_paths":["artifacts/acceptance/issue-55/sha256sums.txt","artifacts/acceptance/issue-55/verification.json"],"schema":{"canonicalization_sha256":"canonicalization:sha256:5f871a41f05d8bab1af662a5c91cce456c05af84c77f602d0572da778ec5f3f9","canonicalization_version":1,"name":"model-benchmark/verification-artifact","sha256":"schema:sha256:bca69392594454ff9fe5b822c8fdd89dba9e9a7104c358ffc45ace7e244a8290","version":1}}