{"case_results":[{"id":"tests/acceptance/issue_123_hy3_manifest/test_hy3_manifest.py::test_published_hy3_manifest_loads_with_sealed_projection","outcome":"passed"}],"command":"@python-env/bin/python @python-env/bin/pytest -q --maxfail=1 tests/acceptance/issue_123_hy3_manifest","input_identities":[{"digest":"source-tree:sha256:f63c5b6dee06a776de2070ff5bcb02537bea7c8f2a2d0f3470879fc69743ed87","name":"acceptance-source-tree"},{"digest":"canonicalization:sha256:5f871a41f05d8bab1af662a5c91cce456c05af84c77f602d0572da778ec5f3f9","name":"canonicalization-contract"},{"digest":"artifact:sha256:f2654f53c16db79297ad7656fa7a56ef64fa4bc26af22c5874c358c7651f72d5","name":"launcher-argv-0"},{"digest":"artifact:sha256:1c4d32ec7be57a9147b3505a6695a738eb2d87c213364a41107425ecfa10f7bb","name":"launcher-argv-1"},{"digest":"artifact:sha256:3c65cccdb5c8c15153f9d8d20af780d5a732ff5c3b16813e0852a2f989fc46c3","name":"pyproject.toml"},{"digest":"artifact:sha256:f2654f53c16db79297ad7656fa7a56ef64fa4bc26af22c5874c358c7651f72d5","name":"python-executable"},{"digest":"artifact:sha256:69fe1a6e7c163c62f767bd0e815930c551016bc75b22307a369a3084128d01c5","name":"schema-catalog"},{"digest":"uv-lock:sha256:ba64a736099f24fca8c94da2dad716613a52f65b21d8ac5e844b1a74040b1f26","name":"uv.lock"}],"issue":123,"output_paths":["artifacts/acceptance/issue-123/sha256sums.txt","artifacts/acceptance/issue-123/verification.json"],"schema":{"canonicalization_sha256":"canonicalization:sha256:5f871a41f05d8bab1af662a5c91cce456c05af84c77f602d0572da778ec5f3f9","canonicalization_version":1,"name":"model-benchmark/verification-artifact","sha256":"schema:sha256:bca69392594454ff9fe5b822c8fdd89dba9e9a7104c358ffc45ace7e244a8290","version":1}}