{"case_results":[{"id":"tests/acceptance/issue_28_foundation_harness/test_acceptance_harness.py::test_collection_failure_removes_stale_authoritative_outputs","outcome":"passed"},{"id":"tests/acceptance/issue_28_foundation_harness/test_acceptance_harness.py::test_exact_issue_path_reproduces_artifacts_and_non_exact_path_fails","outcome":"passed"},{"id":"tests/acceptance/issue_28_foundation_harness/test_acceptance_harness.py::test_mandatory_skip_and_expected_failure_exit_nonzero_without_artifacts","outcome":"passed"},{"id":"tests/acceptance/issue_28_foundation_harness/test_acceptance_harness.py::test_missing_docker_fails_without_skip_or_stale_outputs","outcome":"passed"},{"id":"tests/acceptance/issue_28_foundation_harness/test_acceptance_harness.py::test_require_docker_accepts_a_responding_daemon_probe_and_never_skips","outcome":"passed"},{"id":"tests/acceptance/issue_28_foundation_harness/test_acceptance_harness.py::test_run_live_requires_and_accepts_only_a_sealed_non_secret_attestation","outcome":"passed"},{"id":"tests/acceptance/issue_28_foundation_harness/test_foundation.py::test_canonical_fixture_and_typed_identity_vectors_are_reproducible","outcome":"passed"},{"id":"tests/acceptance/issue_28_foundation_harness/test_foundation.py::test_dependency_direction_and_harbor_import_guards_cover_the_source_tree","outcome":"passed"},{"id":"tests/acceptance/issue_28_foundation_harness/test_foundation.py::test_frozen_uv_project_has_only_immutable_dependency_sources","outcome":"passed"},{"id":"tests/acceptance/issue_28_foundation_harness/test_foundation.py::test_operator_cli_has_human_help_and_canonical_json_without_prompting","outcome":"passed"},{"id":"tests/acceptance/issue_28_foundation_harness/test_foundation.py::test_publication_failure_after_first_write_removes_partial_outputs","outcome":"passed"},{"id":"tests/acceptance/issue_28_foundation_harness/test_foundation.py::test_schema_loader_fails_closed_for_unknown_fields_enums_digests_and_versions","outcome":"passed"},{"id":"tests/acceptance/issue_28_foundation_harness/test_foundation.py::test_verification_writer_is_canonical_reproducible_and_read_back","outcome":"passed"}],"command":"@python-env/bin/python @python-env/bin/pytest -q tests/acceptance/issue_28_foundation_harness --maxfail=1 -p no:cacheprovider","input_identities":[{"digest":"source-tree:sha256:0a4f34ccb188573c496fd968174d613b863f68a6050b9cec2c5a190c2a06a1f7","name":"acceptance-source-tree"},{"digest":"canonicalization:sha256:5f871a41f05d8bab1af662a5c91cce456c05af84c77f602d0572da778ec5f3f9","name":"canonicalization-contract"},{"digest":"artifact:sha256:f2654f53c16db79297ad7656fa7a56ef64fa4bc26af22c5874c358c7651f72d5","name":"launcher-argv-0"},{"digest":"artifact:sha256:067b8b7025a7cd67dd483c77ca9c1cad0927e311962054fab735d74f2cfc45cc","name":"launcher-argv-1"},{"digest":"artifact:sha256:3c65cccdb5c8c15153f9d8d20af780d5a732ff5c3b16813e0852a2f989fc46c3","name":"pyproject.toml"},{"digest":"artifact:sha256:f2654f53c16db79297ad7656fa7a56ef64fa4bc26af22c5874c358c7651f72d5","name":"python-executable"},{"digest":"artifact:sha256:927db8f3b9f7489e99aafd1eaaa3b6bb086606e87db91f4597adb3a3743d01ab","name":"schema-catalog"},{"digest":"uv-lock:sha256:ba64a736099f24fca8c94da2dad716613a52f65b21d8ac5e844b1a74040b1f26","name":"uv.lock"}],"issue":28,"output_paths":["artifacts/acceptance/issue-28/sha256sums.txt","artifacts/acceptance/issue-28/verification.json"],"schema":{"canonicalization_sha256":"canonicalization:sha256:5f871a41f05d8bab1af662a5c91cce456c05af84c77f602d0572da778ec5f3f9","canonicalization_version":1,"name":"model-benchmark/verification-artifact","sha256":"schema:sha256:bca69392594454ff9fe5b822c8fdd89dba9e9a7104c358ffc45ace7e244a8290","version":1}}