{"case_results":[{"id":"tests/acceptance/issue_120_react_author_filter/test_react_author_filter.py::test_qualification_proves_behavior_and_isolation","outcome":"passed"},{"id":"tests/acceptance/issue_120_react_author_filter/test_react_author_filter.py::test_react_package_does_not_activate_existing_functional_v1_runs","outcome":"passed"},{"id":"tests/acceptance/issue_120_react_author_filter/test_react_author_filter.py::test_react_package_is_public_bounded_and_reproducible","outcome":"passed"}],"command":"@python-env/bin/python @python-env/bin/pytest -q tests/acceptance/issue_120_react_author_filter --maxfail=1 -p no:cacheprovider","input_identities":[{"digest":"source-tree:sha256:f72c05d8cea59ba8bb3224d62a2159b60cc64a45201d48b3cf397ef3f1f6a8ca","name":"acceptance-source-tree"},{"digest":"canonicalization:sha256:5f871a41f05d8bab1af662a5c91cce456c05af84c77f602d0572da778ec5f3f9","name":"canonicalization-contract"},{"digest":"artifact:sha256:f2654f53c16db79297ad7656fa7a56ef64fa4bc26af22c5874c358c7651f72d5","name":"launcher-argv-0"},{"digest":"artifact:sha256:6871943dc0504813d6568b9f12cc791fb8ecff4f53b2953edbf17b32426701d7","name":"launcher-argv-1"},{"digest":"artifact:sha256:3c65cccdb5c8c15153f9d8d20af780d5a732ff5c3b16813e0852a2f989fc46c3","name":"pyproject.toml"},{"digest":"artifact:sha256:f2654f53c16db79297ad7656fa7a56ef64fa4bc26af22c5874c358c7651f72d5","name":"python-executable"},{"digest":"artifact:sha256:38ab83bb64d58bb9503052b934a2ffc795dc39d418ab09306d371e661763b189","name":"schema-catalog"},{"digest":"uv-lock:sha256:ba64a736099f24fca8c94da2dad716613a52f65b21d8ac5e844b1a74040b1f26","name":"uv.lock"}],"issue":120,"output_paths":["artifacts/acceptance/issue-120/sha256sums.txt","artifacts/acceptance/issue-120/verification.json"],"schema":{"canonicalization_sha256":"canonicalization:sha256:5f871a41f05d8bab1af662a5c91cce456c05af84c77f602d0572da778ec5f3f9","canonicalization_version":1,"name":"model-benchmark/verification-artifact","sha256":"schema:sha256:bca69392594454ff9fe5b822c8fdd89dba9e9a7104c358ffc45ace7e244a8290","version":1}}