{"case_results":[{"id":"tests/acceptance/issue_40_functional_v1_scenarios/test_functional_v1_scenarios.py::test_diagnostic_qualification_evidence_covers_all_isolated_cases","outcome":"passed"},{"id":"tests/acceptance/issue_40_functional_v1_scenarios/test_functional_v1_scenarios.py::test_locks_reproduce_every_package_identity","outcome":"passed"},{"id":"tests/acceptance/issue_40_functional_v1_scenarios/test_functional_v1_scenarios.py::test_package_set_is_exact_and_diagnostic_only","outcome":"passed"},{"id":"tests/acceptance/issue_40_functional_v1_scenarios/test_functional_v1_scenarios.py::test_sales_fixtures_reproduce_from_the_declared_generator","outcome":"passed"}],"command":"@python-env/bin/python @python-env/bin/pytest -q tests/acceptance/issue_40_functional_v1_scenarios --maxfail=1 -p no:cacheprovider","input_identities":[{"digest":"source-tree:sha256:df7dec72665f7a2a20a2f9b597101f91c8d9a496aff0154071d6b24b17813489","name":"acceptance-source-tree"},{"digest":"canonicalization:sha256:5f871a41f05d8bab1af662a5c91cce456c05af84c77f602d0572da778ec5f3f9","name":"canonicalization-contract"},{"digest":"artifact:sha256:93c469a68969bd462e2ae6ebdcb595a1afe73aa7be31866de7a3e257948de9a0","name":"launcher-argv-0"},{"digest":"artifact:sha256:aa47aaa23e704106b2b7f6ea176d055f183f32f9d025374ae0dbe2eb246de461","name":"launcher-argv-1"},{"digest":"artifact:sha256:3c65cccdb5c8c15153f9d8d20af780d5a732ff5c3b16813e0852a2f989fc46c3","name":"pyproject.toml"},{"digest":"artifact:sha256:93c469a68969bd462e2ae6ebdcb595a1afe73aa7be31866de7a3e257948de9a0","name":"python-executable"},{"digest":"artifact:sha256:92a4e38317ec211e12b2a08eec71a636085a77fa8348b290821323a8aadd6420","name":"schema-catalog"},{"digest":"uv-lock:sha256:ba64a736099f24fca8c94da2dad716613a52f65b21d8ac5e844b1a74040b1f26","name":"uv.lock"}],"issue":40,"output_paths":["artifacts/acceptance/issue-40/sha256sums.txt","artifacts/acceptance/issue-40/verification.json"],"schema":{"canonicalization_sha256":"canonicalization:sha256:5f871a41f05d8bab1af662a5c91cce456c05af84c77f602d0572da778ec5f3f9","canonicalization_version":1,"name":"model-benchmark/verification-artifact","sha256":"schema:sha256:bca69392594454ff9fe5b822c8fdd89dba9e9a7104c358ffc45ace7e244a8290","version":1}}