{"case_results":[{"id":"tests/acceptance/issue_37_evidence_sealing/test_evidence_sealing.py::test_distinguishable_outcomes_drain_to_distinct_terminal_facts","outcome":"passed"},{"id":"tests/acceptance/issue_37_evidence_sealing/test_evidence_sealing.py::test_full_run_drains_to_bundled_terminals_and_sealed_complete_record","outcome":"passed"},{"id":"tests/acceptance/issue_37_evidence_sealing/test_run_record_enrichment.py::test_empty_terminal_details_yield_null_scores_and_placeholders","outcome":"passed"},{"id":"tests/acceptance/issue_37_evidence_sealing/test_run_record_enrichment.py::test_sealed_record_carries_enriched_cells_and_provenance","outcome":"passed"},{"id":"tests/acceptance/issue_37_evidence_sealing/test_run_record_enrichment.py::test_sealing_without_provenance_records_none","outcome":"passed"}],"command":"@python-env/bin/python @python-env/bin/pytest -q tests/acceptance/issue_37_evidence_sealing --maxfail=1 -p no:cacheprovider","input_identities":[{"digest":"source-tree:sha256:d77880faab8dddf6a661de07aa7d6f1f5dcf358a74e35ffcc8f9c8737bcbc0b4","name":"acceptance-source-tree"},{"digest":"canonicalization:sha256:5f871a41f05d8bab1af662a5c91cce456c05af84c77f602d0572da778ec5f3f9","name":"canonicalization-contract"},{"digest":"artifact:sha256:f2654f53c16db79297ad7656fa7a56ef64fa4bc26af22c5874c358c7651f72d5","name":"launcher-argv-0"},{"digest":"artifact:sha256:a02285196b6e5f62a2c777186618fe2eef457c4f6d95cee0eee6ef0bf8bb5b3b","name":"launcher-argv-1"},{"digest":"artifact:sha256:3c65cccdb5c8c15153f9d8d20af780d5a732ff5c3b16813e0852a2f989fc46c3","name":"pyproject.toml"},{"digest":"artifact:sha256:f2654f53c16db79297ad7656fa7a56ef64fa4bc26af22c5874c358c7651f72d5","name":"python-executable"},{"digest":"artifact:sha256:92a4e38317ec211e12b2a08eec71a636085a77fa8348b290821323a8aadd6420","name":"schema-catalog"},{"digest":"uv-lock:sha256:ba64a736099f24fca8c94da2dad716613a52f65b21d8ac5e844b1a74040b1f26","name":"uv.lock"}],"issue":37,"output_paths":["artifacts/acceptance/issue-37/sha256sums.txt","artifacts/acceptance/issue-37/verification.json"],"schema":{"canonicalization_sha256":"canonicalization:sha256:5f871a41f05d8bab1af662a5c91cce456c05af84c77f602d0572da778ec5f3f9","canonicalization_version":1,"name":"model-benchmark/verification-artifact","sha256":"schema:sha256:bca69392594454ff9fe5b822c8fdd89dba9e9a7104c358ffc45ace7e244a8290","version":1}}