{"case_results":[{"id":"tests/acceptance/issue_51_proof_hardening/test_proof_hardening.py::test_early_configuration_failure_removes_stale_outputs","outcome":"passed"},{"id":"tests/acceptance/issue_51_proof_hardening/test_proof_hardening.py::test_explicit_inputs_are_path_safe_and_sealed","outcome":"passed"},{"id":"tests/acceptance/issue_51_proof_hardening/test_proof_hardening.py::test_failed_docker_daemon_probe_removes_stale_outputs","outcome":"passed"},{"id":"tests/acceptance/issue_51_proof_hardening/test_proof_hardening.py::test_import_alias_architecture_regressions_pass","outcome":"passed"},{"id":"tests/acceptance/issue_51_proof_hardening/test_proof_hardening.py::test_initial_conftest_failure_removes_stale_outputs","outcome":"passed"},{"id":"tests/acceptance/issue_51_proof_hardening/test_proof_hardening.py::test_rejected_test_node_target_removes_stale_outputs","outcome":"passed"},{"id":"tests/acceptance/issue_51_proof_hardening/test_proof_hardening.py::test_required_docker_daemon_is_observable","outcome":"passed"},{"id":"tests/acceptance/issue_51_proof_hardening/test_proof_hardening.py::test_selection_and_deselection_cannot_publish_partial_success","outcome":"passed"},{"id":"tests/acceptance/issue_51_proof_hardening/test_proof_hardening.py::test_shared_fixture_changes_are_sealed_into_source_identity","outcome":"passed"},{"id":"tests/acceptance/issue_51_proof_hardening/test_proof_hardening.py::test_verification_records_the_observed_python_process_command","outcome":"passed"}],"command":"@python-env/bin/python @python-env/bin/pytest -q tests/acceptance/issue_51_proof_hardening --maxfail=1 -p no:cacheprovider --require-docker --acceptance-input=tests/architecture","input_identities":[{"digest":"source-tree:sha256:855bdfd9adfeb1962591e2ed0219579c96a0915aeaf6706e30e933ce100772ac","name":"acceptance-source-tree"},{"digest":"canonicalization:sha256:5f871a41f05d8bab1af662a5c91cce456c05af84c77f602d0572da778ec5f3f9","name":"canonicalization-contract"},{"digest":"artifact:sha256:c5de60e2cfe84baa5be4887aca63111e95ce56457b2a5119334844c045644a29","name":"docker-server-version"},{"digest":"artifact:sha256:f2654f53c16db79297ad7656fa7a56ef64fa4bc26af22c5874c358c7651f72d5","name":"launcher-argv-0"},{"digest":"artifact:sha256:a02285196b6e5f62a2c777186618fe2eef457c4f6d95cee0eee6ef0bf8bb5b3b","name":"launcher-argv-1"},{"digest":"artifact:sha256:3c65cccdb5c8c15153f9d8d20af780d5a732ff5c3b16813e0852a2f989fc46c3","name":"pyproject.toml"},{"digest":"artifact:sha256:f2654f53c16db79297ad7656fa7a56ef64fa4bc26af22c5874c358c7651f72d5","name":"python-executable"},{"digest":"artifact:sha256:92a4e38317ec211e12b2a08eec71a636085a77fa8348b290821323a8aadd6420","name":"schema-catalog"},{"digest":"uv-lock:sha256:ba64a736099f24fca8c94da2dad716613a52f65b21d8ac5e844b1a74040b1f26","name":"uv.lock"}],"issue":51,"output_paths":["artifacts/acceptance/issue-51/sha256sums.txt","artifacts/acceptance/issue-51/verification.json"],"schema":{"canonicalization_sha256":"canonicalization:sha256:5f871a41f05d8bab1af662a5c91cce456c05af84c77f602d0572da778ec5f3f9","canonicalization_version":1,"name":"model-benchmark/verification-artifact","sha256":"schema:sha256:bca69392594454ff9fe5b822c8fdd89dba9e9a7104c358ffc45ace7e244a8290","version":1}}