{"case_results":[{"id":"tests/acceptance/issue_35_hermes_condition/test_hermes_condition.py::test_condition_lock_seals_exact_stock_hermes_profile","outcome":"passed"},{"id":"tests/acceptance/issue_35_hermes_condition/test_hermes_condition.py::test_fresh_oneshot_trials_preserve_native_behavior_and_complete_evidence","outcome":"passed"},{"id":"tests/acceptance/issue_35_hermes_condition/test_hermes_condition.py::test_image_identity_does_not_depend_on_storage_driver_size","outcome":"passed"},{"id":"tests/acceptance/issue_35_hermes_condition/test_hermes_condition.py::test_provision_pulls_exact_image_once_and_warm_preflight_is_read_only","outcome":"passed"},{"id":"tests/acceptance/issue_35_hermes_condition/test_hermes_condition.py::test_unsupported_oneshot_behavior_is_unqualified_without_fallback","outcome":"passed"}],"command":"@python-env/bin/python @python-env/bin/pytest -q tests/acceptance/issue_35_hermes_condition --maxfail=1 -p no:cacheprovider","input_identities":[{"digest":"source-tree:sha256:2a2b7b4aece66fe4c9d8efd86e6cd90ddb0a7ae602766ef67592b38f8c92bd73","name":"acceptance-source-tree"},{"digest":"canonicalization:sha256:5f871a41f05d8bab1af662a5c91cce456c05af84c77f602d0572da778ec5f3f9","name":"canonicalization-contract"},{"digest":"artifact:sha256:b582020e080302a9b27f7e057169c6506aa9fcd2e5134b9e46753ecaada2bc6e","name":"hermes-digest-first-warm-preflight"},{"digest":"artifact:sha256:8d704121f6ad30b6bfb4b451c48a835ed15f79309bfe659ec3dfe7f550cab1d8","name":"hermes-oneshot-qualified"},{"digest":"artifact:sha256:93c469a68969bd462e2ae6ebdcb595a1afe73aa7be31866de7a3e257948de9a0","name":"launcher-argv-0"},{"digest":"artifact:sha256:aa47aaa23e704106b2b7f6ea176d055f183f32f9d025374ae0dbe2eb246de461","name":"launcher-argv-1"},{"digest":"artifact:sha256:3c65cccdb5c8c15153f9d8d20af780d5a732ff5c3b16813e0852a2f989fc46c3","name":"pyproject.toml"},{"digest":"artifact:sha256:93c469a68969bd462e2ae6ebdcb595a1afe73aa7be31866de7a3e257948de9a0","name":"python-executable"},{"digest":"artifact:sha256:92a4e38317ec211e12b2a08eec71a636085a77fa8348b290821323a8aadd6420","name":"schema-catalog"},{"digest":"artifact:sha256:24e5d2d3167eefb206ea57cc5bd31df4fbad1ca4a61e690abe3dc1861a2fabae","name":"sealed-hermes-identities"},{"digest":"artifact:sha256:cd4c897d211a0eb31678ec4b166882c82a666cf71308f09df22aed8c097f8246","name":"unsupported-hermes-unqualified"},{"digest":"uv-lock:sha256:ba64a736099f24fca8c94da2dad716613a52f65b21d8ac5e844b1a74040b1f26","name":"uv.lock"}],"issue":35,"output_paths":["artifacts/acceptance/issue-35/sha256sums.txt","artifacts/acceptance/issue-35/verification.json"],"schema":{"canonicalization_sha256":"canonicalization:sha256:5f871a41f05d8bab1af662a5c91cce456c05af84c77f602d0572da778ec5f3f9","canonicalization_version":1,"name":"model-benchmark/verification-artifact","sha256":"schema:sha256:bca69392594454ff9fe5b822c8fdd89dba9e9a7104c358ffc45ace7e244a8290","version":1}}