{"case_results":[{"id":"tests/acceptance/issue_34_opencode_condition/test_opencode_condition.py::test_condition_lock_seals_exact_stock_opencode_profile","outcome":"passed"},{"id":"tests/acceptance/issue_34_opencode_condition/test_opencode_condition.py::test_fresh_run_trials_preserve_stock_autonomy_and_complete_evidence","outcome":"passed"},{"id":"tests/acceptance/issue_34_opencode_condition/test_opencode_condition.py::test_provision_extracts_once_and_warm_preflight_is_read_only","outcome":"passed"},{"id":"tests/acceptance/issue_34_opencode_condition/test_opencode_condition.py::test_unsupported_run_behavior_is_unqualified_without_fallback","outcome":"passed"}],"command":"@python-env/bin/python @python-env/bin/pytest -q tests/acceptance/issue_34_opencode_condition --maxfail=1 -p no:cacheprovider","input_identities":[{"digest":"source-tree:sha256:12ae803fcdd431da751f63341cb5673d80aa820a7dd108b21da075ba417a86ed","name":"acceptance-source-tree"},{"digest":"canonicalization:sha256:5f871a41f05d8bab1af662a5c91cce456c05af84c77f602d0572da778ec5f3f9","name":"canonicalization-contract"},{"digest":"artifact:sha256:f2654f53c16db79297ad7656fa7a56ef64fa4bc26af22c5874c358c7651f72d5","name":"launcher-argv-0"},{"digest":"artifact:sha256:a02285196b6e5f62a2c777186618fe2eef457c4f6d95cee0eee6ef0bf8bb5b3b","name":"launcher-argv-1"},{"digest":"artifact:sha256:7393a6f5098c14a3dbb2f792c90233b3ca9bd19d2ea9c77ba8928332950649cb","name":"opencode-digest-first-warm-preflight"},{"digest":"artifact:sha256:a5caf3a9a28bfd5b6e5c157a6960a44d0248a20f8ebcc7f97483b89d6ec0b466","name":"opencode-run-qualified"},{"digest":"artifact:sha256:3c65cccdb5c8c15153f9d8d20af780d5a732ff5c3b16813e0852a2f989fc46c3","name":"pyproject.toml"},{"digest":"artifact:sha256:f2654f53c16db79297ad7656fa7a56ef64fa4bc26af22c5874c358c7651f72d5","name":"python-executable"},{"digest":"artifact:sha256:92a4e38317ec211e12b2a08eec71a636085a77fa8348b290821323a8aadd6420","name":"schema-catalog"},{"digest":"artifact:sha256:9c7901a3bf50dad0954802d28b945a9bd343b0ab7e465a1cb32bb712bd0d8477","name":"sealed-opencode-identities"},{"digest":"artifact:sha256:2292374b79109d5104476aefcfc4477b1d2fbb23b3203a8aadbd54e3f1d5e612","name":"unsupported-opencode-unqualified"},{"digest":"uv-lock:sha256:ba64a736099f24fca8c94da2dad716613a52f65b21d8ac5e844b1a74040b1f26","name":"uv.lock"}],"issue":34,"output_paths":["artifacts/acceptance/issue-34/sha256sums.txt","artifacts/acceptance/issue-34/verification.json"],"schema":{"canonicalization_sha256":"canonicalization:sha256:5f871a41f05d8bab1af662a5c91cce456c05af84c77f602d0572da778ec5f3f9","canonicalization_version":1,"name":"model-benchmark/verification-artifact","sha256":"schema:sha256:bca69392594454ff9fe5b822c8fdd89dba9e9a7104c358ffc45ace7e244a8290","version":1}}