{"case_results":[{"id":"tests/acceptance/issue_29_scenario_authoring/test_scenario_authoring.py::test_authoring_gates_fail_closed[duplicate-yaml-invalid-scenario-yaml]","outcome":"passed"},{"id":"tests/acceptance/issue_29_scenario_authoring/test_scenario_authoring.py::test_authoring_gates_fail_closed[hidden-marker-answer-leakage]","outcome":"passed"},{"id":"tests/acceptance/issue_29_scenario_authoring/test_scenario_authoring.py::test_authoring_gates_fail_closed[profile-drift-profile-mismatch]","outcome":"passed"},{"id":"tests/acceptance/issue_29_scenario_authoring/test_scenario_authoring.py::test_authoring_gates_fail_closed[unknown-schema-field-invalid-scenario-schema]","outcome":"passed"},{"id":"tests/acceptance/issue_29_scenario_authoring/test_scenario_authoring.py::test_authoritative_schemas_are_catalogued_and_strict","outcome":"passed"},{"id":"tests/acceptance/issue_29_scenario_authoring/test_scenario_authoring.py::test_each_ecosystem_fixture_passes_schema_and_exact_pinned_harbor_loader[angular-typescript]","outcome":"passed"},{"id":"tests/acceptance/issue_29_scenario_authoring/test_scenario_authoring.py::test_each_ecosystem_fixture_passes_schema_and_exact_pinned_harbor_loader[python-data-engineering]","outcome":"passed"},{"id":"tests/acceptance/issue_29_scenario_authoring/test_scenario_authoring.py::test_each_ecosystem_fixture_passes_schema_and_exact_pinned_harbor_loader[spring-boot-java]","outcome":"passed"},{"id":"tests/acceptance/issue_29_scenario_authoring/test_scenario_authoring.py::test_non_patch_output_requires_harbor_sidecar_collect_materialization","outcome":"passed"},{"id":"tests/acceptance/issue_29_scenario_authoring/test_scenario_authoring.py::test_pristine_seed_baseline_and_dataset_are_reconstructed_without_downloads","outcome":"passed"},{"id":"tests/acceptance/issue_29_scenario_authoring/test_scenario_authoring.py::test_production_qualify_measures_harbor_and_seals_authenticated_evidence","outcome":"passed"},{"id":"tests/acceptance/issue_29_scenario_authoring/test_scenario_authoring.py::test_qualification_review_and_identity_failures_leave_no_authoritative_pqr[package-changed-after-review-instruction-digest-mismatch]","outcome":"passed"},{"id":"tests/acceptance/issue_29_scenario_authoring/test_scenario_authoring.py::test_qualification_review_and_identity_failures_leave_no_authoritative_pqr[qualification-download-invalid-technical-qualification]","outcome":"passed"},{"id":"tests/acceptance/issue_29_scenario_authoring/test_scenario_authoring.py::test_qualification_review_and_identity_failures_leave_no_authoritative_pqr[reward-mismatch-invalid-infrastructure]","outcome":"passed"},{"id":"tests/acceptance/issue_29_scenario_authoring/test_scenario_authoring.py::test_qualification_review_and_identity_failures_leave_no_authoritative_pqr[stale-review-stale-independent-review]","outcome":"passed"},{"id":"tests/acceptance/issue_29_scenario_authoring/test_scenario_authoring.py::test_qualification_review_and_identity_failures_leave_no_authoritative_pqr[unsafe-handoff-succeeds-invalid-technical-qualification]","outcome":"passed"},{"id":"tests/acceptance/issue_29_scenario_authoring/test_scenario_authoring.py::test_scaffold_check_and_lock_are_byte_reproducible","outcome":"passed"},{"id":"tests/acceptance/issue_29_scenario_authoring/test_scenario_authoring.py::test_scenario_state_flow_is_closed","outcome":"passed"},{"id":"tests/acceptance/issue_29_scenario_authoring/test_scenario_authoring.py::test_technical_qualification_review_and_pqr_ordering","outcome":"passed"}],"command":"@python-env/bin/python @python-env/bin/pytest -q tests/acceptance/issue_29_scenario_authoring --maxfail=1 -p no:cacheprovider","input_identities":[{"digest":"source-tree:sha256:5751eab4f8df348d72d769456695b6ced2fff0230abb6c2fe282725e952eebd2","name":"acceptance-source-tree"},{"digest":"canonicalization:sha256:5f871a41f05d8bab1af662a5c91cce456c05af84c77f602d0572da778ec5f3f9","name":"canonicalization-contract"},{"digest":"artifact:sha256:c5de60e2cfe84baa5be4887aca63111e95ce56457b2a5119334844c045644a29","name":"docker-server-version"},{"digest":"artifact:sha256:f2654f53c16db79297ad7656fa7a56ef64fa4bc26af22c5874c358c7651f72d5","name":"launcher-argv-0"},{"digest":"artifact:sha256:a02285196b6e5f62a2c777186618fe2eef457c4f6d95cee0eee6ef0bf8bb5b3b","name":"launcher-argv-1"},{"digest":"artifact:sha256:3c65cccdb5c8c15153f9d8d20af780d5a732ff5c3b16813e0852a2f989fc46c3","name":"pyproject.toml"},{"digest":"artifact:sha256:f2654f53c16db79297ad7656fa7a56ef64fa4bc26af22c5874c358c7651f72d5","name":"python-executable"},{"digest":"artifact:sha256:92a4e38317ec211e12b2a08eec71a636085a77fa8348b290821323a8aadd6420","name":"schema-catalog"},{"digest":"uv-lock:sha256:ba64a736099f24fca8c94da2dad716613a52f65b21d8ac5e844b1a74040b1f26","name":"uv.lock"}],"issue":29,"output_paths":["artifacts/acceptance/issue-29/sha256sums.txt","artifacts/acceptance/issue-29/verification.json"],"schema":{"canonicalization_sha256":"canonicalization:sha256:5f871a41f05d8bab1af662a5c91cce456c05af84c77f602d0572da778ec5f3f9","canonicalization_version":1,"name":"model-benchmark/verification-artifact","sha256":"schema:sha256:bca69392594454ff9fe5b822c8fdd89dba9e9a7104c358ffc45ace7e244a8290","version":1}}