{"case_results":[{"id":"tests/acceptance/issue_54_verification_policy/test_verification_policy.py::test_closed_world_selection_covers_targeted_and_fail_closed_paths","outcome":"passed"},{"id":"tests/acceptance/issue_54_verification_policy/test_verification_policy.py::test_development_denies_network_and_restores_authoritative_outputs","outcome":"passed"},{"id":"tests/acceptance/issue_54_verification_policy/test_verification_policy.py::test_issue_and_shared_inputs_select_local_verification","outcome":"passed"},{"id":"tests/acceptance/issue_54_verification_policy/test_verification_policy.py::test_missing_mandatory_inventory_cannot_publish","outcome":"passed"},{"id":"tests/acceptance/issue_54_verification_policy/test_verification_policy.py::test_non_passing_mandatory_case_cannot_publish[skip]","outcome":"passed"},{"id":"tests/acceptance/issue_54_verification_policy/test_verification_policy.py::test_non_passing_mandatory_case_cannot_publish[xfail]","outcome":"passed"},{"id":"tests/acceptance/issue_54_verification_policy/test_verification_policy.py::test_partial_acceptance_selection_cannot_publish[deselect]","outcome":"passed"},{"id":"tests/acceptance/issue_54_verification_policy/test_verification_policy.py::test_partial_acceptance_selection_cannot_publish[ignore]","outcome":"passed"},{"id":"tests/acceptance/issue_54_verification_policy/test_verification_policy.py::test_partial_acceptance_selection_cannot_publish[keyword]","outcome":"passed"},{"id":"tests/acceptance/issue_54_verification_policy/test_verification_policy.py::test_partial_acceptance_selection_cannot_publish[marker]","outcome":"passed"},{"id":"tests/acceptance/issue_54_verification_policy/test_verification_policy.py::test_tier_outputs_have_disjoint_authority_and_diagnostic_shape","outcome":"passed"}],"command":"@python-env/bin/python @python-env/bin/pytest -q tests/acceptance/issue_54_verification_policy --maxfail=1 -p no:cacheprovider","input_identities":[{"digest":"source-tree:sha256:d6615045f93ce5434748e22b2c8f793fe2622fa431505d09623f4834b052e4cd","name":"acceptance-source-tree"},{"digest":"canonicalization:sha256:5f871a41f05d8bab1af662a5c91cce456c05af84c77f602d0572da778ec5f3f9","name":"canonicalization-contract"},{"digest":"artifact:sha256:f2654f53c16db79297ad7656fa7a56ef64fa4bc26af22c5874c358c7651f72d5","name":"launcher-argv-0"},{"digest":"artifact:sha256:9a342635e8ec1d80f35e09e932eba24c75b4bcc13e33bfd2c14254eee152e929","name":"launcher-argv-1"},{"digest":"artifact:sha256:3c65cccdb5c8c15153f9d8d20af780d5a732ff5c3b16813e0852a2f989fc46c3","name":"pyproject.toml"},{"digest":"artifact:sha256:f2654f53c16db79297ad7656fa7a56ef64fa4bc26af22c5874c358c7651f72d5","name":"python-executable"},{"digest":"artifact:sha256:92a4e38317ec211e12b2a08eec71a636085a77fa8348b290821323a8aadd6420","name":"schema-catalog"},{"digest":"uv-lock:sha256:ba64a736099f24fca8c94da2dad716613a52f65b21d8ac5e844b1a74040b1f26","name":"uv.lock"}],"issue":54,"output_paths":["artifacts/acceptance/issue-54/sha256sums.txt","artifacts/acceptance/issue-54/verification.json"],"schema":{"canonicalization_sha256":"canonicalization:sha256:5f871a41f05d8bab1af662a5c91cce456c05af84c77f602d0572da778ec5f3f9","canonicalization_version":1,"name":"model-benchmark/verification-artifact","sha256":"schema:sha256:bca69392594454ff9fe5b822c8fdd89dba9e9a7104c358ffc45ace7e244a8290","version":1}}