{"case_results":[{"id":"tests/acceptance/issue_36/test_execution.py::test_four_condition_locks_pin_exact_read_only_image_payloads","outcome":"passed"},{"id":"tests/acceptance/issue_36/test_execution.py::test_harbor_agent_command_has_only_proxy_credentials","outcome":"passed"},{"id":"tests/acceptance/issue_36/test_execution.py::test_harbor_overlay_exposes_only_selected_image_and_proxy_route","outcome":"passed"},{"id":"tests/acceptance/issue_36/test_execution.py::test_missing_provider_usage_or_cost_is_invalid_infrastructure","outcome":"passed"},{"id":"tests/acceptance/issue_36/test_execution.py::test_native_preflight_rejects_before_docker_on_non_linux","outcome":"passed"},{"id":"tests/acceptance/issue_36/test_execution.py::test_provider_limit_and_score_vector_are_terminal_facts","outcome":"passed"},{"id":"tests/acceptance/issue_36/test_execution.py::test_runtime_package_binds_prebuilt_main_and_verifier_images","outcome":"passed"},{"id":"tests/acceptance/issue_36/test_execution.py::test_scheduler_starts_exactly_three_and_refills_in_fixed_order","outcome":"passed"},{"id":"tests/acceptance/issue_36/test_execution.py::test_shared_fault_stops_refill_and_terminates_running_cells","outcome":"passed"}],"command":"@python-env/bin/python @python-env/bin/pytest -q --maxfail=1 tests/acceptance/issue_36","input_identities":[{"digest":"source-tree:sha256:125e67f9f41da8e483ed1cf46b8d67529d455064464726140a2716121df2492b","name":"acceptance-source-tree"},{"digest":"canonicalization:sha256:5f871a41f05d8bab1af662a5c91cce456c05af84c77f602d0572da778ec5f3f9","name":"canonicalization-contract"},{"digest":"artifact:sha256:32970af187f3c15e0ec81f2b9ee32cfb60b3cebf105f320675bb4a4eeae277d5","name":"fixed-three-slot-schedule"},{"digest":"artifact:sha256:94f969efe286a99d8fddc6a148d4a1bfa225f2d629ac1916994a598ab9189320","name":"four-condition-image-locks"},{"digest":"artifact:sha256:93c469a68969bd462e2ae6ebdcb595a1afe73aa7be31866de7a3e257948de9a0","name":"launcher-argv-0"},{"digest":"artifact:sha256:132f142c5d60f5c033bc7c5295e35e11eaad37303a6588c2a4d21d2927da632d","name":"launcher-argv-1"},{"digest":"artifact:sha256:3c65cccdb5c8c15153f9d8d20af780d5a732ff5c3b16813e0852a2f989fc46c3","name":"pyproject.toml"},{"digest":"artifact:sha256:93c469a68969bd462e2ae6ebdcb595a1afe73aa7be31866de7a3e257948de9a0","name":"python-executable"},{"digest":"artifact:sha256:92a4e38317ec211e12b2a08eec71a636085a77fa8348b290821323a8aadd6420","name":"schema-catalog"},{"digest":"artifact:sha256:c54d198b863ca287f06e0dd1aa4c5202f94ffa5568b356b8f12c66f51b7ecaac","name":"selected-image-proxy-only-overlay"},{"digest":"artifact:sha256:a7df7414509553590b27c8e93503200661715362f7ee7a94f887f46bec88f3d7","name":"shared-fault-stops-refill"},{"digest":"uv-lock:sha256:ba64a736099f24fca8c94da2dad716613a52f65b21d8ac5e844b1a74040b1f26","name":"uv.lock"}],"issue":36,"output_paths":["artifacts/acceptance/issue-36/sha256sums.txt","artifacts/acceptance/issue-36/verification.json"],"schema":{"canonicalization_sha256":"canonicalization:sha256:5f871a41f05d8bab1af662a5c91cce456c05af84c77f602d0572da778ec5f3f9","canonicalization_version":1,"name":"model-benchmark/verification-artifact","sha256":"schema:sha256:bca69392594454ff9fe5b822c8fdd89dba9e9a7104c358ffc45ace7e244a8290","version":1}}