{"case_results":[{"id":"tests/acceptance/issue_32_condition_runner/test_conditions.py::test_changed_immutable_artifact_fails_before_process_or_provider_launch","outcome":"passed"},{"id":"tests/acceptance/issue_32_condition_runner/test_conditions.py::test_fresh_homes_share_no_mutable_harness_state","outcome":"passed"},{"id":"tests/acceptance/issue_32_condition_runner/test_conditions.py::test_injected_secret_leak_is_invalid_infrastructure_and_capture_is_quarantined","outcome":"passed"},{"id":"tests/acceptance/issue_32_condition_runner/test_conditions.py::test_three_harness_shapes_use_one_isolated_process_boundary_and_recording_provider[hermes]","outcome":"passed"},{"id":"tests/acceptance/issue_32_condition_runner/test_conditions.py::test_three_harness_shapes_use_one_isolated_process_boundary_and_recording_provider[omp]","outcome":"passed"},{"id":"tests/acceptance/issue_32_condition_runner/test_conditions.py::test_three_harness_shapes_use_one_isolated_process_boundary_and_recording_provider[opencode]","outcome":"passed"},{"id":"tests/acceptance/issue_32_condition_runner/test_conditions.py::test_wall_time_limit_terminates_the_process_group_and_preserves_capture_handoff","outcome":"passed"},{"id":"tests/acceptance/issue_32_condition_runner/test_credential_proxy.py::test_auth_replacement_and_streaming_preserve_bytes_and_observe_native_retries","outcome":"passed"},{"id":"tests/acceptance/issue_32_condition_runner/test_credential_proxy.py::test_enforcement_uses_derived_total_and_records_reported_cost_alongside","outcome":"passed"},{"id":"tests/acceptance/issue_32_condition_runner/test_credential_proxy.py::test_missing_provider_usage_invalidates_the_route_after_streaming_response","outcome":"passed"},{"id":"tests/acceptance/issue_32_condition_runner/test_credential_proxy.py::test_missing_token_split_under_pricing_record_blocks_fail_closed","outcome":"passed"},{"id":"tests/acceptance/issue_32_condition_runner/test_credential_proxy.py::test_pricing_record_derives_cost_when_provider_omits_cost","outcome":"passed"},{"id":"tests/acceptance/issue_32_condition_runner/test_credential_proxy.py::test_pricing_record_rejects_invalid_identity_and_rates[artifact:sha256:0000000000000000000000000000000000000000000000000000000000000000-0.10-0.20-wrong kind]","outcome":"passed"},{"id":"tests/acceptance/issue_32_condition_runner/test_credential_proxy.py::test_pricing_record_rejects_invalid_identity_and_rates[not-a-typed-digest-0.10-0.20-identity is invalid]","outcome":"passed"},{"id":"tests/acceptance/issue_32_condition_runner/test_credential_proxy.py::test_pricing_record_rejects_invalid_identity_and_rates[pricing-record:sha256:0000000000000000000000000000000000000000000000000000000000000000-0-0.20-finite and positive]","outcome":"passed"},{"id":"tests/acceptance/issue_32_condition_runner/test_credential_proxy.py::test_pricing_record_rejects_invalid_identity_and_rates[pricing-record:sha256:0000000000000000000000000000000000000000000000000000000000000000-0.10--0.20-finite and positive]","outcome":"passed"},{"id":"tests/acceptance/issue_32_condition_runner/test_credential_proxy.py::test_pricing_record_rejects_invalid_identity_and_rates[pricing-record:sha256:0000000000000000000000000000000000000000000000000000000000000000-0.10-Infinity-finite and positive]","outcome":"passed"},{"id":"tests/acceptance/issue_32_condition_runner/test_credential_proxy.py::test_pricing_record_rejects_invalid_identity_and_rates[pricing-record:sha256:0000000000000000000000000000000000000000000000000000000000000000-NaN-0.20-finite and positive]","outcome":"passed"},{"id":"tests/acceptance/issue_32_condition_runner/test_credential_proxy.py::test_provider_failed_native_retry_is_observed_and_charged_without_proxy_retry","outcome":"passed"},{"id":"tests/acceptance/issue_32_condition_runner/test_credential_proxy.py::test_route_model_and_auth_controls_fail_closed_before_provider","outcome":"passed"},{"id":"tests/acceptance/issue_32_condition_runner/test_credential_proxy.py::test_service_main_builds_its_config_from_the_cell_environment","outcome":"passed"},{"id":"tests/acceptance/issue_32_condition_runner/test_credential_proxy.py::test_service_main_fails_at_startup_when_an_environment_variable_is_missing","outcome":"passed"},{"id":"tests/acceptance/issue_32_condition_runner/test_credential_proxy.py::test_sixty_fifth_request_is_denied_without_an_upstream_retry","outcome":"passed"},{"id":"tests/acceptance/issue_32_condition_runner/test_credential_proxy.py::test_stream_cost_event_records_maximum_reported_cost_despite_trailing_zero","outcome":"passed"},{"id":"tests/acceptance/issue_32_condition_runner/test_credential_proxy.py::test_token_and_cost_thresholds_stop_after_one_overshooting_response","outcome":"passed"},{"id":"tests/acceptance/issue_32_condition_runner/test_credential_proxy.py::test_top_level_cost_string_zero_is_valid_reported_spend","outcome":"passed"},{"id":"tests/acceptance/issue_32_condition_runner/test_credential_proxy.py::test_usage_token_counts_accept_alternate_field_names","outcome":"passed"},{"id":"tests/acceptance/issue_32_condition_runner/test_credential_proxy.py::test_zero_request_trial_still_produces_readable_empty_evidence","outcome":"passed"},{"id":"tests/acceptance/issue_32_condition_runner/test_raw_api.py::test_invalid_raw_api_envelope_is_terminal_without_retry[not json-invalid-provider-json-128]","outcome":"passed"},{"id":"tests/acceptance/issue_32_condition_runner/test_raw_api.py::test_invalid_raw_api_envelope_is_terminal_without_retry[{\"content\": \"\\\\ud800\", \"path\": \"src/answer.py\"}-invalid-content-encoding-128]","outcome":"passed"},{"id":"tests/acceptance/issue_32_condition_runner/test_raw_api.py::test_invalid_raw_api_envelope_is_terminal_without_retry[{\"content\": \"after\", \"extra\": true, \"path\": \"src/answer.py\"}-invalid-materialization-envelope-128]","outcome":"passed"},{"id":"tests/acceptance/issue_32_condition_runner/test_raw_api.py::test_invalid_raw_api_envelope_is_terminal_without_retry[{\"content\": \"after\", \"path\": \"src/wrong.py\"}-response-path-mismatch-128]","outcome":"passed"},{"id":"tests/acceptance/issue_32_condition_runner/test_raw_api.py::test_invalid_raw_api_envelope_is_terminal_without_retry[{\"content\": \"xxxxxxxxxxxxxxxxxxxxxxxxxxxxxxxxxxxxxxxxxxxxxxxxxxxxxxxxxxxxxxxxxxxxxxxxxxxxxxxxxxxxxxxxxxxxxxxxxxxxxxxxxxxxxxxxxxxxxxxxxxxxxxxxx\", \"path\": \"src/answer.py\"}-content-size-limit-128]","outcome":"passed"},{"id":"tests/acceptance/issue_32_condition_runner/test_raw_api.py::test_invalid_raw_api_envelope_is_terminal_without_retry[{\"path\":\"src/answer.py\",\"content\":\"a\",\"path\":\"src/answer.py\"}-duplicate-json-field-128]","outcome":"passed"},{"id":"tests/acceptance/issue_32_condition_runner/test_raw_api.py::test_provider_refusal_and_failure_are_terminal_without_retry","outcome":"passed"},{"id":"tests/acceptance/issue_32_condition_runner/test_raw_api.py::test_raw_api_makes_one_request_and_atomically_changes_only_locked_file","outcome":"passed"}],"command":"@python-env/bin/python @python-env/bin/pytest -q tests/acceptance/issue_32_condition_runner --maxfail=1 -p no:cacheprovider","input_identities":[{"digest":"source-tree:sha256:4429b31dd93ff664683b9fcbe045d78137a64b330de9311c97d2e3aaf0972106","name":"acceptance-source-tree"},{"digest":"canonicalization:sha256:5f871a41f05d8bab1af662a5c91cce456c05af84c77f602d0572da778ec5f3f9","name":"canonicalization-contract"},{"digest":"artifact:sha256:f2654f53c16db79297ad7656fa7a56ef64fa4bc26af22c5874c358c7651f72d5","name":"launcher-argv-0"},{"digest":"artifact:sha256:a02285196b6e5f62a2c777186618fe2eef457c4f6d95cee0eee6ef0bf8bb5b3b","name":"launcher-argv-1"},{"digest":"artifact:sha256:3c65cccdb5c8c15153f9d8d20af780d5a732ff5c3b16813e0852a2f989fc46c3","name":"pyproject.toml"},{"digest":"artifact:sha256:f2654f53c16db79297ad7656fa7a56ef64fa4bc26af22c5874c358c7651f72d5","name":"python-executable"},{"digest":"artifact:sha256:92a4e38317ec211e12b2a08eec71a636085a77fa8348b290821323a8aadd6420","name":"schema-catalog"},{"digest":"uv-lock:sha256:ba64a736099f24fca8c94da2dad716613a52f65b21d8ac5e844b1a74040b1f26","name":"uv.lock"}],"issue":32,"output_paths":["artifacts/acceptance/issue-32/sha256sums.txt","artifacts/acceptance/issue-32/verification.json"],"schema":{"canonicalization_sha256":"canonicalization:sha256:5f871a41f05d8bab1af662a5c91cce456c05af84c77f602d0572da778ec5f3f9","canonicalization_version":1,"name":"model-benchmark/verification-artifact","sha256":"schema:sha256:bca69392594454ff9fe5b822c8fdd89dba9e9a7104c358ffc45ace7e244a8290","version":1}}