{"case_results":[{"id":"tests/acceptance/issue_33_omp_condition/test_omp_condition.py::test_condition_lock_seals_the_exact_stock_omp_profile","outcome":"passed"},{"id":"tests/acceptance/issue_33_omp_condition/test_omp_condition.py::test_fresh_rpc_trials_preserve_stock_transport_and_complete_evidence","outcome":"passed"},{"id":"tests/acceptance/issue_33_omp_condition/test_omp_condition.py::test_provision_is_digest_first_and_warm_preflight_is_read_only","outcome":"passed"},{"id":"tests/acceptance/issue_33_omp_condition/test_omp_condition.py::test_unsupported_rpc_behavior_is_unqualified_without_fallback","outcome":"passed"}],"command":"@python-env/bin/python @python-env/bin/pytest -q tests/acceptance/issue_33_omp_condition --maxfail=1 -p no:cacheprovider","input_identities":[{"digest":"source-tree:sha256:b4bf9d2b37990967a02a4ed9132526bf5accdafbe02e6d5067ef703af30e3e35","name":"acceptance-source-tree"},{"digest":"canonicalization:sha256:5f871a41f05d8bab1af662a5c91cce456c05af84c77f602d0572da778ec5f3f9","name":"canonicalization-contract"},{"digest":"artifact:sha256:7393a6f5098c14a3dbb2f792c90233b3ca9bd19d2ea9c77ba8928332950649cb","name":"digest-first-warm-preflight"},{"digest":"artifact:sha256:f2654f53c16db79297ad7656fa7a56ef64fa4bc26af22c5874c358c7651f72d5","name":"launcher-argv-0"},{"digest":"artifact:sha256:067b8b7025a7cd67dd483c77ca9c1cad0927e311962054fab735d74f2cfc45cc","name":"launcher-argv-1"},{"digest":"artifact:sha256:a6752c14b3725012f24318cd2302b1b417ce6be899fee7533ce72587b0c4d736","name":"omp-rpc-qualified"},{"digest":"artifact:sha256:3c65cccdb5c8c15153f9d8d20af780d5a732ff5c3b16813e0852a2f989fc46c3","name":"pyproject.toml"},{"digest":"artifact:sha256:f2654f53c16db79297ad7656fa7a56ef64fa4bc26af22c5874c358c7651f72d5","name":"python-executable"},{"digest":"artifact:sha256:927db8f3b9f7489e99aafd1eaaa3b6bb086606e87db91f4597adb3a3743d01ab","name":"schema-catalog"},{"digest":"artifact:sha256:7fab97f4beec2fb831a6a156a75c2727c3dee05d2ec59317562e7b224c00a56d","name":"sealed-omp-identities"},{"digest":"artifact:sha256:77b66d1c70f12416fb88beb2713980b9078682886e606a95c4a4d4042b27c19f","name":"unsupported-omp-unqualified"},{"digest":"uv-lock:sha256:ba64a736099f24fca8c94da2dad716613a52f65b21d8ac5e844b1a74040b1f26","name":"uv.lock"}],"issue":33,"output_paths":["artifacts/acceptance/issue-33/sha256sums.txt","artifacts/acceptance/issue-33/verification.json"],"schema":{"canonicalization_sha256":"canonicalization:sha256:5f871a41f05d8bab1af662a5c91cce456c05af84c77f602d0572da778ec5f3f9","canonicalization_version":1,"name":"model-benchmark/verification-artifact","sha256":"schema:sha256:bca69392594454ff9fe5b822c8fdd89dba9e9a7104c358ffc45ace7e244a8290","version":1}}